{
  "id": "P1-08",
  "project_id": "ai-organisation-os",
  "type": "qa",
  "title": "Phase 1 stop condition validation",
  "description": "Final validation that all Phase 1 stop conditions from docs/ARCHITECTURE.md are met: (1) A role cannot execute a stage it does not own, (2) The project dashboard output includes workload counts per role, (3) Every run's status.json contains a responsible_agent field, (4) Every backlog item has an assigned role and the picker skips items without one, (5) No cross-role leakage is possible with test proof. Run all tests, verify dashboard output, and confirm each condition with evidence.",
  "created_at": "2026-02-19T12:00:00Z",
  "updated_at": "2026-02-20T15:30:00Z",
  "status": "done",
  "priority": "P2",
  "owner_role": "QA",
  "depends_on": ["P1-06", "P1-07"],
  "run_folder": null,
  "tags": ["phase-1", "validation", "stop-condition"],
  "artifacts_expected": [],
  "phase": "Phase 1",
  "stop_condition": "All 5 Phase 1 stop conditions evaluate to true. Phase 1 is declared complete."
}
