{
  "id": "P1-05",
  "project_id": "ai-organisation-os",
  "type": "dev",
  "title": "Assigned role required on every backlog item",
  "description": "Make the owner_role field (which serves as the assigned role) mandatory in practice, not just in schema. Update the project-next-pick script to skip any backlog item where owner_role is missing or empty. Log a warning to stderr for skipped items. This ensures every item in the scheduling pipeline has a clear role assignment.",
  "created_at": "2026-02-19T12:00:00Z",
  "updated_at": "2026-02-20T11:00:00Z",
  "status": "done",
  "priority": "P1",
  "owner_role": "DEV",
  "depends_on": [],
  "run_folder": null,
  "tags": ["phase-1", "role-enforcement", "picker"],
  "artifacts_expected": ["skills/dev-pipeline/scripts/project-next-pick.js (modified)"],
  "phase": "Phase 1",
  "stop_condition": "The picker skips backlog items without an assigned role. A warning is emitted to stderr for each skipped item."
}
