{
  "id": "P1-06",
  "project_id": "ai-organisation-os",
  "type": "qa",
  "title": "Role leakage prevention tests",
  "description": "Write comprehensive tests that verify role enforcement cannot be bypassed. Test cases: (1) DEV agent cannot produce QA artifacts, (2) QA agent cannot produce DEV artifacts, (3) PM agent cannot produce ARCHITECT artifacts, (4) An agent with no assigned role is rejected, (5) Role enforcement works across stage transitions, (6) The responsible_agent field is always populated after transitions. These tests serve as the definitive proof that cross-role leakage is impossible.",
  "created_at": "2026-02-19T12:00:00Z",
  "updated_at": "2026-02-19T12:00:00Z",
  "status": "todo",
  "priority": "P1",
  "owner_role": "QA",
  "depends_on": ["P1-02", "P1-03"],
  "run_folder": null,
  "tags": ["phase-1", "testing", "role-enforcement"],
  "artifacts_expected": ["skills/dev-pipeline/tests/test-role-enforcement.js"],
  "phase": "Phase 1",
  "stop_condition": "All 6 test cases pass. No cross-role leakage is possible. Tests are registered in tools/test-all.sh."
}
