{
  "id": "P2-01",
  "project_id": "ai-organisation-os",
  "type": "dev",
  "title": "Add parent_id field to backlog item schema and data model",
  "description": "Extend backlog-item.schema.json with an optional parent_id field (string or null). Update project-index.js buildBacklogEntry to pass through parent_id. Update project-dashboard.js to include parent_id in item output. Update project-dashboard.output.schema.json to include parent_id. Existing backlog items without parent_id must continue to work (default null). The type 'epic' becomes meaningful: epics are items that have children referencing them via parent_id.",
  "created_at": "2026-02-20T16:00:00Z",
  "updated_at": "2026-02-20T17:00:00Z",
  "status": "done",
  "priority": "P1",
  "owner_role": "DEV",
  "depends_on": [],
  "run_folder": null,
  "tags": ["phase-2", "schema", "parent-child"],
  "artifacts_expected": [
    "skills/dev-pipeline/schemas/backlog-item.schema.json (modified)",
    "skills/dev-pipeline/scripts/project-index.js (modified)",
    "skills/dev-pipeline/scripts/project-dashboard.js (modified)",
    "skills/dev-pipeline/schemas/project-dashboard.output.schema.json (modified)"
  ],
  "phase": "Phase 2",
  "stop_condition": "parent_id field exists in backlog-item schema. project-index and project-dashboard expose it. Existing items without parent_id default to null. All tests pass."
}
