{
  "id": "P2-07",
  "project_id": "ai-organisation-os",
  "type": "docs",
  "title": "Phase 2 documentation update",
  "description": "Update SKILL.md to document the graph validation tool, graph-aware picker behavior, epic completion rule, blocked reason enforcement, and dashboard dependency chain fields. Update ARCHITECTURE.md section 4.3 to document parent_id. Update test listings with all new Phase 2 test suites.",
  "created_at": "2026-02-20T16:00:00Z",
  "updated_at": "2026-02-20T21:30:00Z",
  "status": "done",
  "priority": "P2",
  "owner_role": "PM",
  "depends_on": ["P2-01", "P2-02", "P2-03", "P2-04", "P2-05", "P2-06"],
  "run_folder": null,
  "tags": ["phase-2", "documentation"],
  "artifacts_expected": [
    "skills/dev-pipeline/SKILL.md (modified)",
    "docs/ARCHITECTURE.md (modified)"
  ],
  "phase": "Phase 2",
  "stop_condition": "All Phase 2 features are documented. SKILL.md and ARCHITECTURE.md are consistent with the implementation."
}
