{
  "id": "P1-02",
  "project_id": "ai-organisation-os",
  "type": "dev",
  "title": "Role-to-stage enforcement in run engine",
  "description": "Add runtime role enforcement to the run engine. Each stage in STAGE_CONFIG declares which role owns it. Before an artifact can be written to a stage directory, the engine must verify that the requesting agent's role matches the stage's declared role. If the role does not match, the engine must reject the submission with a clear error. This prevents cross-role leakage where e.g. a DEV agent produces QA artifacts.",
  "created_at": "2026-02-19T12:00:00Z",
  "updated_at": "2026-02-19T21:35:00Z",
  "status": "done",
  "priority": "P0",
  "owner_role": "DEV",
  "depends_on": ["P1-01"],
  "run_folder": null,
  "tags": ["phase-1", "role-enforcement"],
  "artifacts_expected": ["skills/dev-pipeline/scripts/run-next-safe.js (modified)", "skills/dev-pipeline/scripts/dev-pipeline.js (modified)"],
  "phase": "Phase 1",
  "stop_condition": "A role cannot execute a stage it does not own. The run engine rejects artifact submissions from the wrong role with a JSON error."
}
