{
  "id": "P2-05",
  "project_id": "ai-organisation-os",
  "type": "dev",
  "title": "Blocked reason enforcement for unfinished dependencies",
  "description": "When the graph validator or picker detects that a task has unfinished dependencies, the blocked_reason should identify which dependency is blocking. Update the graph validator to emit warnings for tasks that are todo/in_progress but have unfinished depends_on items. Update the picker's skip warning to include the blocking dependency IDs. This is informational enforcement (warnings and skip reasons), not automatic status mutation.",
  "created_at": "2026-02-20T16:00:00Z",
  "updated_at": "2026-02-20T16:00:00Z",
  "status": "todo",
  "priority": "P2",
  "owner_role": "DEV",
  "depends_on": ["P2-02", "P2-03"],
  "run_folder": null,
  "tags": ["phase-2", "blocked-reason", "dependencies"],
  "artifacts_expected": [
    "skills/dev-pipeline/scripts/validate-backlog-graph.js (modified)",
    "skills/dev-pipeline/scripts/project-next-pick.js (modified)"
  ],
  "phase": "Phase 2",
  "stop_condition": "Picker skip warnings include blocking dependency IDs. Graph validator reports tasks with unfinished dependencies. Tests verify both."
}
