{
  "id": "P1-04",
  "project_id": "ai-organisation-os",
  "type": "dev",
  "title": "Agent workload in project dashboard output",
  "description": "Extend the project dashboard output to include agent workload statistics. For each agent identity in the project, compute: total runs assigned, stages completed, currently active runs. Add a workload_by_role summary to the dashboard output with runs_per_role and stages_per_role counts. Update the dashboard schema to include the new fields.",
  "created_at": "2026-02-19T12:00:00Z",
  "updated_at": "2026-02-19T12:00:00Z",
  "status": "todo",
  "priority": "P1",
  "owner_role": "DEV",
  "depends_on": ["P1-01", "P1-03"],
  "run_folder": null,
  "tags": ["phase-1", "dashboard", "workload"],
  "artifacts_expected": ["skills/dev-pipeline/schemas/project-dashboard.output.schema.json (modified)", "skills/dev-pipeline/scripts/project-dashboard.js (modified)"],
  "phase": "Phase 1",
  "stop_condition": "The project dashboard output includes workload counts per role. The schema validates the new fields."
}
