{
  "id": "P1-07",
  "project_id": "ai-organisation-os",
  "type": "docs",
  "title": "Phase 1 documentation and SKILL.md update",
  "description": "Update SKILL.md to document the new agent state contract, role enforcement rules, responsible_agent field, and workload dashboard fields. Update ARCHITECTURE.md to reflect the completed Phase 1 deliverables. Ensure all new schemas, scripts, and tools are referenced in the documentation.",
  "created_at": "2026-02-19T12:00:00Z",
  "updated_at": "2026-02-19T12:00:00Z",
  "status": "todo",
  "priority": "P2",
  "owner_role": "PM",
  "depends_on": ["P1-02", "P1-03", "P1-04", "P1-05", "P1-06"],
  "run_folder": null,
  "tags": ["phase-1", "documentation"],
  "artifacts_expected": ["skills/dev-pipeline/SKILL.md (modified)", "docs/ARCHITECTURE.md (modified)"],
  "phase": "Phase 1",
  "stop_condition": "All Phase 1 features are documented. SKILL.md and ARCHITECTURE.md are consistent with the implementation."
}
